{
  "schema_version": "emlis.observation_structure_dictionary.v1",
  "dictionary_id": "emlis_observation_structure_dictionary",
  "dictionary_version": "emlis.observation_structure_dictionary.action_conversion_unformed_self_insight.2026-05-22",
  "contract_step": "Phase2_Observation_Structure_Dictionary_Schema",
  "base_dictionary": "cocolon_foundation_structure_dictionary",
  "status": "implementation_schema_phase2",
  "purpose": "EmlisAIが入力の束を根拠に、ユーザーの状態を観測するための専用構造辞書。入力語・入力束・関係・内部問い・allowed/forbidden inference・surface policy を持つ。",
  "non_goals": [
    "完成返答文テンプレ集",
    "一般共感文集",
    "人格診断",
    "原因決め打ち",
    "Piece生成辞書",
    "分析レポート辞書"
  ],
  "input_bundle_policy": {
    "required_current_input_fields": [
      "memo",
      "memo_action",
      "emotion_details",
      "category"
    ],
    "normalized_field_mapping": {
      "thought_text": {
        "source_field": "memo",
        "meaning": "自己世界の出来事。内側で起きた解釈・反応・思考。"
      },
      "action_text": {
        "source_field": "memo_action",
        "meaning": "実世界の出来事。実際に起きたこと・したこと。"
      },
      "emotions": {
        "source_field": "emotion_details",
        "fallback_fields": [
          "emotions"
        ],
        "meaning": "ユーザーが選んだ状態の前提。"
      },
      "emotion_strength_summary": {
        "source_field": "emotion_details",
        "meaning": "状態の重さ。原因断定には使わない。"
      },
      "categories": {
        "source_field": "category",
        "meaning": "話題の方向。原因ではない。"
      },
      "selected_at": {
        "source_field": "created_at",
        "meaning": "今回入力の時点情報。時間推移判断には使わない。"
      },
      "source_record_id": {
        "source_field": "id",
        "meaning": "現在入力の保存レコードID。public contract renameには使わない。"
      }
    },
    "field_meanings": {
      "memo": "自己世界の出来事。内側で起きた解釈・反応・思考。",
      "memo_action": "実世界の出来事。実際に起きたこと・したこと。",
      "emotion_details": "ユーザーが選んだ状態の前提。",
      "emotion_strength": "状態の重さ。原因断定には使わない。",
      "category": "話題の方向。原因ではない。",
      "created_at": "今回入力の時点情報。時間推移判断は別領域。"
    },
    "source_priority": [
      "current_input_explicit_fields",
      "current_input_direct_relations",
      "connected_user_facts",
      "dictionary_candidates",
      "general_knowledge_not_primary"
    ]
  },
  "global_policies": {
    "emotion_policy": {
      "selected_emotion_is_state_premise": true,
      "multiple_emotions_read_as_center_and_surrounding": true,
      "emotion_nesting_allowed": true,
      "emotion_strength_affects_state_weight_only": true,
      "emotion_strength_must_not_create_cause": true,
      "self_insight_is_not_ordinary_emotion": true
    },
    "category_policy": {
      "category_is_topic_direction_not_cause": true,
      "multiple_categories_default_relation": "category_parallel",
      "category_overlap_requires_textual_evidence": true
    },
    "thought_action_policy": {
      "memo_is_self_world_event": true,
      "memo_action_is_real_world_event": true,
      "explicit_discrepancy_should_be_observed": true,
      "surface_order_default": "real_world_fact_to_inner_state_to_human_accompaniment"
    },
    "state_text_gap_policy": {
      "gap_words": [
        "大丈夫",
        "平気",
        "なんでもない",
        "大したことない",
        "大丈夫なはず",
        "まあいいか"
      ],
      "default_surface_strength": "soft",
      "strong_surface_requires": [
        "emotion_strength_strong",
        "clear_gap_word",
        "supporting_memo_or_action_evidence"
      ],
      "strong_surface_must_not_be_low_grounding": true
    },
    "low_information_policy": {
      "short_text_is_not_always_low_information": true,
      "must_state_known_scope": true,
      "must_not_fill_unknown_event": true,
      "prompt_relation": "user_agency_prompt"
    },
    "user_agency_prompt_policy": {
      "preferred_verbs": [
        "残してください",
        "残しても大丈夫です",
        "残せるところだけ残してください"
      ],
      "avoid_verbs": [
        "教えてください",
        "話してください",
        "相談してください",
        "説明してください"
      ],
      "must_preserve_user_agency": true
    },
    "surface_policy": {
      "dictionary_is_not_completed_reply_template": true,
      "composer_owns_final_order": true,
      "surface_realizer_owns_final_japanese": true,
      "must_not_return_entry_text_directly": true
    }
  },
  "relations": [
    {
      "relation_id": "desire_stagnation",
      "definition": "変えたい・進みたい願望と、変化できない現実の停滞を候補として読む関係。",
      "evidence_requirements": [
        "願望語と停止語が同じ入力束内にある",
        "原因は本文根拠がある時だけ扱う"
      ],
      "allowed_inference": [
        "願望と現状の差がある",
        "変化の止まりが負荷になっている可能性を弱く扱う"
      ],
      "forbidden_inference": [
        "環境や人間関係が原因と決める",
        "継続期間を低根拠で足す"
      ],
      "surface_policy": {
        "default_strength": "soft",
        "must_use_humility_marker": true,
        "must_not_return_directly": true
      }
    },
    {
      "relation_id": "load_accumulation",
      "definition": "負荷が一回性ではなく蓄積している可能性を候補として読む関係。",
      "evidence_requirements": [
        "疲労・消耗・反復・継続語、または過去事実との明示接続がある"
      ],
      "allowed_inference": [
        "負荷が残っている",
        "反復根拠がある場合のみ蓄積として弱く扱う"
      ],
      "forbidden_inference": [
        "根拠なしに長く続いていると断定する",
        "疲れやすい性格にする"
      ],
      "surface_policy": {
        "default_strength": "soft",
        "must_use_humility_marker": true,
        "must_not_return_directly": true
      }
    },
    {
      "relation_id": "action_blocked",
      "definition": "行動したいが動けない、または動く条件が整っていない状態を候補として読む関係。",
      "evidence_requirements": [
        "行動願望と停止・不能語が同じ入力束内にある"
      ],
      "allowed_inference": [
        "行動と実行の間に距離がある",
        "停止条件がある可能性を扱う"
      ],
      "forbidden_inference": [
        "怠惰・弱さとして人格化する",
        "努力不足と決める"
      ],
      "surface_policy": {
        "default_strength": "soft",
        "must_use_humility_marker": true,
        "must_not_return_directly": true
      }
    },
    {
      "relation_id": "pressure_gap",
      "definition": "現状と期待・願望・責任の差が圧力として残っている可能性を候補として読む関係。",
      "evidence_requirements": [
        "期待・責任・現状差を示す語が入力束内にある"
      ],
      "allowed_inference": [
        "差分が圧力に近い状態として残っている可能性"
      ],
      "forbidden_inference": [
        "誰からの圧力かを勝手に足す",
        "社会的評価を補完する"
      ],
      "surface_policy": {
        "default_strength": "soft",
        "must_use_humility_marker": true,
        "must_not_return_directly": true
      }
    },
    {
      "relation_id": "repetition",
      "definition": "同じ思考・状況・試行が繰り返されている可能性を候補として読む関係。",
      "evidence_requirements": [
        "繰り返し語、継続語、または現在入力に接続できる過去ユーザー事実がある"
      ],
      "allowed_inference": [
        "同じ構造が繰り返されている可能性",
        "過去事実がある場合だけ継続として扱う"
      ],
      "forbidden_inference": [
        "過去事実なしに続いていると強く言う",
        "反応パターンを人格化する"
      ],
      "surface_policy": {
        "default_strength": "soft",
        "must_use_humility_marker": true,
        "must_not_return_directly": true
      }
    },
    {
      "relation_id": "priority_pressure",
      "definition": "対象が大きく扱われ続けることで負荷が出ている可能性を候補として読む関係。",
      "evidence_requirements": [
        "対象語と負荷語が現在入力で直接つながる"
      ],
      "allowed_inference": [
        "その対象が入力内で大きく扱われている可能性"
      ],
      "forbidden_inference": [
        "重要視していると断定する",
        "執着などの心理語へ寄せる"
      ],
      "surface_policy": {
        "default_strength": "soft",
        "must_use_humility_marker": true,
        "must_not_return_directly": true
      }
    },
    {
      "relation_id": "low_information_weight",
      "definition": "詳細は少ないが、重さや限界感だけは入力束から見えている状態。",
      "evidence_requirements": [
        "短文でも感情・強度・カテゴリ・入力語から状態の重さが見える",
        "出来事・対象・原因は未確定として残す"
      ],
      "allowed_inference": [
        "見えている状態の重さだけを扱う",
        "未知の出来事を明示してユーザー主導で促す"
      ],
      "forbidden_inference": [
        "職場・人間関係・過去の傷を補完する",
        "質問だけで終わる"
      ],
      "surface_policy": {
        "default_strength": "medium",
        "must_use_humility_marker": true,
        "must_not_return_directly": true
      }
    },
    {
      "relation_id": "state_text_gap",
      "definition": "選択された感情状態と、本文に置いた言葉が乖離している状態。",
      "evidence_requirements": [
        "感情選択と本文の語が同じ入力束内にある",
        "強表現は感情strongと補助根拠がある時だけ使う"
      ],
      "allowed_inference": [
        "感情状態と本文の間に差がある",
        "その言葉を置いていること自体を観測する"
      ],
      "forbidden_inference": [
        "本当の感情を決め打ちする",
        "嘘をついていると扱う",
        "自分に言い聞かせていると低根拠で断定する"
      ],
      "surface_policy": {
        "default_strength": "soft",
        "must_use_humility_marker": true,
        "must_not_return_directly": true
      }
    },
    {
      "relation_id": "emotion_nesting",
      "definition": "強い感情の箱の中に、別の感情が混ざっている状態。",
      "evidence_requirements": [
        "複数感情が同じ入力に選択されている",
        "中心と周辺は強度と順序から弱く扱う"
      ],
      "allowed_inference": [
        "中心感情と周辺感情が同じ入力内にある",
        "感情の混ざりを弱く表現する"
      ],
      "forbidden_inference": [
        "本当の感情を断定する",
        "防衛などの心理診断語にする",
        "感情を割合で表示する"
      ],
      "surface_policy": {
        "default_strength": "soft",
        "must_use_humility_marker": true,
        "must_not_return_directly": true
      }
    },
    {
      "relation_id": "thought_action_discrepancy",
      "definition": "実世界の行動と、自己世界の思考・感情がズレている状態。",
      "evidence_requirements": [
        "memo_actionとmemoの両方に明示された差がある"
      ],
      "allowed_inference": [
        "外側の行動と内側の状態の差を観測する",
        "情報が明確なら踏み込んだ状態言語化を行う"
      ],
      "forbidden_inference": [
        "ズレがない入力にズレを作る",
        "我慢する性格などに人格化する"
      ],
      "surface_policy": {
        "default_strength": "strong_when_high_grounding",
        "must_use_humility_marker": true,
        "must_not_return_directly": true
      }
    },
    {
      "relation_id": "category_parallel",
      "definition": "複数カテゴリを、本文根拠なしでは並列の話題方向として受け取る関係。",
      "evidence_requirements": [
        "複数カテゴリがある",
        "本文内にカテゴリ間の因果根拠がない"
      ],
      "allowed_inference": [
        "複数カテゴリの両方に関係する話題方向として扱う"
      ],
      "forbidden_inference": [
        "片方を原因にする",
        "カテゴリだけで影響関係を作る"
      ],
      "surface_policy": {